H2,2010,2010,2010,4,0,1,Import,364,Iran,IRN,0,World,WLD,,,,,,,,1005,Maize (corn).,8,Weight in kilograms,3626642636,,,,3626642636,,919642522,,,0
H2,2010,2010,2010,4,0,1,Import,364,Iran,IRN,0,World,WLD,,,,,,,,1006,Rice.,8,Weight in kilograms,1132332695,,,,1132332695,,942002921,,,0
H2,2010,2010,2010,4,0,1,Import,364,Iran,IRN,0,World,WLD,,,,,,,,1008,"Buckwheat, millet and canary seed; other cereals.",8,Weight in kilograms,10775614,,,,10775614,,3694460,,,0
H2,2010,2010,2010,4,0,1,Import,364,Iran,IRN,0,World,WLD,,,,,,,,1101,Wheat or meslin flour.,8,Weight in kilograms,30450,,,,30450,,25096,,,0
H2,2010,2010,2010,4,0,1,Import,364,Iran,IRN,0,World,WLD,,,,,,,,1102,Cereal flours other than of wheat or meslin.,8,Weight in kilograms,279728,,,,279728,,82904,,,0
H2,2010,2010,2010,4,0,1,Import,364,Iran,IRN,0,World,WLD,,,,,,,,1103,"Cereal groats, meal and pellets.",8,Weight in kilograms,1254650,,,,1254650,,974735,,,0
H2,2010,2010,2010,4,0,1,Import,364,Iran,IRN,0,World,WLD,,,,,,,,1104,Cereal grains otherwise worked,8,Weight in kilograms,60384,,,,60384,,56430,,,0
H2,2010,2010,2010,4,0,1,Import,364,Iran,IRN,0,World,WLD,,,,,,,,1105,"Flour, meal, powder, flakes, granules and pellets of potatoes.",8,Weight in kilograms,1205978,,,,1205978,,1381214,,,0
H2,2010,2010,2010,4,0,1,Import,364,Iran,IRN,0,World,WLD,,,,,,,,1106,"Flour, meal and powder of heading 07.13",8,Weight in kilograms,307640,,,,307640,,1763125,,,0
H2,2010,2010,2010,4,0,1,Import,364,Iran,IRN,0,World,WLD,,,,,,,,1107,"Malt, whether or not roasted.",8,Weight in kilograms,9090777,,,,9090777,,5407225,,,0
H2,2010,2010,2010,4,0,1,Import,364,Iran,IRN,0,World,WLD,,,,,,,,1108,Starches; inulin.,8,Weight in kilograms,1661346,,,,1661346,,1118690,,,0
H2,2010,2010,2010,4,0,1,Import,364,Iran,IRN,0,World,WLD,,,,,,,,1109,"Wheat gluten, whether or not dried.",8,Weight in kilograms,41250,,,,41250,,96002,,,0
H2,2010,2010,2010,4,0,1,Import,364,Iran,IRN,0,World,WLD,,,,,,,,1201,"Soya beans, whether or not broken.",8,Weight in kilograms,856445869,,,,856445869,,386692717,,,0
H2,2010,2010,2010,4,0,1,Import,364,Iran,IRN,0,World,WLD,,,,,,,,1202,"Ground-nuts, not roasted or otherwise cooked",8,Weight in kilograms,25396040,,,,25396040,,18251578,,,0
H2,2010,2010,2010,4,0,1,Import,364,Iran,IRN,0,World,WLD,,,,,,,,1203,Copra.,8,Weight in kilograms,46600,,,,46600,,41857,,,0
H2,2010,2010,2010,4,0,1,Import,364,Iran,IRN,0,World,WLD,,,,,,,,1204,"Linseed, whether or not broken.",8,Weight in kilograms,1605689,,,,1605689,,1318722,,,0
H2,2010,2010,2010,4,0,1,Import,364,Iran,IRN,0,World,WLD,,,,,,,,1205,"Rape or colza seeds, whether or not broken.",8,Weight in kilograms,5954391,,,,5954391,,3175961,,,0
H2,2010,2010,2010,4,0,1,Import,364,Iran,IRN,0,World,WLD,,,,,,,,1206,"Sunflower seeds, whether or not broken.",8,Weight in kilograms,31179137,,,,31179137,,23945021,,,0
H2,2010,2010,2010,4,0,1,Import,364,Iran,IRN,0,World,WLD,,,,,,,,1207,Other oil seeds and oleaginous fruits,8,Weight in kilograms,28605295,,,,28605295,,24971664,,,0
H2,2010,2010,2010,4,0,1,Import,364,Iran,IRN,0,World,WLD,,,,,,,,1208,Flours and meals of oil seeds or oleaginous fruits,8,Weight in kilograms,530160,,,,530160,,825593,,,0
H2,2010,2010,2010,4,0,1,Import,364,Iran,IRN,0,World,WLD,,,,,,,,1209,"Seeds, fruit and spores, of a kind used for sowing.",8,Weight in kilograms,13678853,,,,13678853,,85245096,,,0
H2,2010,2010,2010,4,0,1,Import,364,Iran,IRN,0,World,WLD,,,,,,,,1210,"Hop cones, fresh or dried",8,Weight in kilograms,800,,,,800,,6397,,,0
H2,2010,2010,2010,4,0,1,Import,364,Iran,IRN,0,World,WLD,,,,,,,,1211,Plants and parts of plants (including seeds and fruits),8,Weight in kilograms,3223730,,,,3223730,,1152936,,,0
H2,2010,2010,2010,4,0,1,Import,364,Iran,IRN,0,World,WLD,,,,,,,,1212,"Locust beans, seaweeds and other algae",8,Weight in kilograms,43878,,,,43878,,32662,,,0
H2,2010,2010,2010,4,0,1,Import,364,Iran,IRN,0,World,WLD,,,,,,,,1301,"Lac; natural gums, resins, gum-resins and oleoresins",8,Weight in kilograms,714698,,,,714698,,2648439,,,0
H2,2010,2010,2010,4,0,1,Import,364,Iran,IRN,0,World,WLD,,,,,,,,1302,Vegetable saps and extracts; pectic substances,8,Weight in kilograms,10556212,,,,10556212,,24488607,,,0
H2,2010,2010,2010,4,0,1,Import,364,Iran,IRN,0,World,WLD,,,,,,,,1401,Vegetable materials primarily for plaiting,8,Weight in kilograms,208525,,,,208525,,89094,,,0
H2,2010,2010,2010,4,0,1,Import,364,Iran,IRN,0,World,WLD,,,,,,,,1404,Vegetable products not elsewhere specified,8,Weight in kilograms,1116414,,,,1116414,,473787,,,0
H2,2010,2010,2010,4,0,1,Import,364,Iran,IRN,0,World,WLD,,,,,,,,1502,"Fats of bovine animals, sheep or goats",8,Weight in kilograms,381932,,,,381932,,399040,,,0
H2,2010,2010,2010,4,0,1,Import,364,Iran,IRN,0,World,WLD,,,,,,,,1503,"Lard stearin, lard oil, oleostearin and tallow oil",8,Weight in kilograms,37992,,,,37992,,25540,,,0
H2,2010,2010,2010,4,0,1,Import,364,Iran,IRN,0,World,WLD,,,,,,,,1504,"Fats and oils and their fractions, of fish or marine mammals",8,Weight in kilograms,251950,,,,251950,,1659418,,,0
H2,2010,2010,2010,4,0,1,Import,364,Iran,IRN,0,World,WLD,,,,,,,,1505,Wool grease and fatty substances derived therefrom,8,Weight in kilograms,224685,,,,224685,,1593001,,,0
H2,2010,2010,2010,4,0,1,Import,364,Iran,IRN,0,World,WLD,,,,,,,,1507,Soya-bean oil and its fractions,8,Weight in kilograms,380108632,,,,380108632,,363986360,,,0
H2,2010,2010,2010,4,0,1,Import,364,Iran,IRN,0,World,WLD,,,,,,,,1508,Ground-nut oil and its fractions,8,Weight in kilograms,6460,,,,6460,,28841,,,0
H2,2010,2010,2010,4,0,1,Import,364,Iran,IRN,0,World,WLD,,,,,,,,1509,Olive oil and its fractions,8,Weight in kilograms,4366645,,,,4366645,,8066613,,,0
H2,2010,2010,2010,4,0,1,Import,364,Iran,IRN,0,World,WLD,,,,,,,,1510,"Other oils and their fractions, obtained solely from olives",8,Weight in kilograms,10613,,,,10613,,21004,,,0
H2,2010,2010,2010,4,0,1,Import,364,Iran,IRN,0,World,WLD,,,,,,,,1511,Palm oil and its fractions,8,Weight in kilograms,621543289,,,,621543289,,542986928,,,0
H2,2010,2010,2010,4,0,1,Import,364,Iran,IRN,0,World,WLD,,,,,,,,1512,"Sunflower-seed, safflower or cotton-seed oil",8,Weight in kilograms,151521128,,,,151521128,,144651334,,,0
H2,2010,2010,2010,4,0,1,Import,364,Iran,IRN,0,World,WLD,,,,,,,,1513,"Coconut (copra), palm kernel or babassu oil",8,Weight in kilograms,19249259,,,,19249259,,19308435,,,0
H2,2010,2010,2010,4,0,1,Import,364,Iran,IRN,0,World,WLD,,,,,,,,1514,"Rape, colza or mustard oil",8,Weight in kilograms,9187983,,,,9187983,,9336821,,,0
H2,2010,2010,2010,4,0,1,Import,364,Iran,IRN,0,World,WLD,,,,,,,,1515,Other fixed vegetable fats and oils,8,Weight in kilograms,6895562,,,,6895562,,8257401,,,0
H2,2010,2010,2010,4,0,1,Import,364,Iran,IRN,0,World,WLD,,,,,,,,1516,Animal or vegetable fats and oils,8,Weight in kilograms,15152310,,,,15152310,,19626525,,,0
H2,2010,2010,2010,4,0,1,Import,364,Iran,IRN,0,World,WLD,,,,,,,,1517,Margarine; edible mixtures,8,Weight in kilograms,8784018,,,,8784018,,11868926,,,0
H2,2010,2010,2010,4,0,1,Import,364,Iran,IRN,0,World,WLD,,,,,,,,1518,Animal or vegetable fats and oils,8,Weight in kilograms,1109033,,,,1109033,,1620540,,,0
H2,2010,2010,2010,4,0,1,Import,364,Iran,IRN,0,World,WLD,,,,,,,,1520,"Glycerol, crude; glycerol waters and glycerol lyes.",8,Weight in kilograms,7805970,,,,7805970,,2626714,,,0
H2,2010,2010,2010,4,0,1,Import,364,Iran,IRN,0,World,WLD,,,,,,,,1521,Vegetable waxes (other than triglycerides),8,Weight in kilograms,219925,,,,219925,,1343814,,,0
H2,2010,2010,2010,4,0,1,Import,364,Iran,IRN,0,World,WLD,,,,,,,,1522,Degras; residues,8,Weight in kilograms,1963310,,,,1963310,,263584,,,0
H2,2010,2010,2010,4,0,1,Import,364,Iran,IRN,0,World,WLD,,,,,,,,1602,"Other prepared or preserved meat, meat offal or blood.",8,Weight in kilograms,16000,,,,16000,,55539,,,0
H2,2010,2010,2010,4,0,1,Import,364,Iran,IRN,0,World,WLD,,,,,,,,1603,"Extracts and juices of meat, fish or crustaceans",8,Weight in kilograms,90094,,,,90094,,229497,,,0
H2,2010,2010,2010,4,0,1,Import,364,Iran,IRN,0,World,WLD,,,,,,,,1604,Prepared or preserved fish; caviar,8,Weight in kilograms,3755881,,,,3755881,,6107525,,,0
H2,2010,2010,2010,4,0,1,Import,364,Iran,IRN,0,World,WLD,,,,,,,,1605,"Crustaceans, molluscs and other aquatic invertebrates",8,Weight in kilograms,1556,,,,1556,,10301,,,0
H2,2010,2010,2010,4,0,1,Import,364,Iran,IRN,0,World,WLD,,,,,,,,1701,"Cane or beet sugar and pure sucrose, in solid form.",8,Weight in kilograms,1813610621,,,,1813610621,,762516506,,,0
H2,2010,2010,2010,4,0,1,Import,364,Iran,IRN,0,World,WLD,,,,,,,,1702,"Other sugars, including pure lactose, glucose and fructose",8,Weight in kilograms,18062133,,,,18062133,,13559026,,,0
H2,2010,2010,2010,4,0,1,Import,364,Iran,IRN,0,World,WLD,,,,,,,,1703,Molasses resulting from the extraction or refining of sugar.,8,Weight in kilograms,111873606,,,,111873606,,8226088,,,0
H2,2010,2010,2010,4,0,1,Import,364,Iran,IRN,0,World,WLD,,,,,,,,1704,"Sugar confectionery, not containing cocoa.",8,Weight in kilograms,4451791,,,,4451791,,5727487,,,0
H2,2010,2010,2010,4,0,1,Import,364,Iran,IRN,0,World,WLD,,,,,,,,1801,"Cocoa beans, whole or broken, raw or roasted.",8,Weight in kilograms,9220000,,,,9220000,,30571390,,,0
H2,2010,2010,2010,4,0,1,Import,364,Iran,IRN,0,World,WLD,,,,,,,,1803,"Cocoa paste, whether or not defatted.",8,Weight in kilograms,439000,,,,439000,,2299955,,,0
H2,2010,2010,2010,4,0,1,Import,364,Iran,IRN,0,World,WLD,,,,,,,,1804,"Cocoa butter, fat and oil.",8,Weight in kilograms,1602330,,,,1602330,,9175434,,,0
H2,2010,2010,2010,4,0,1,Import,364,Iran,IRN,0,World,WLD,,,,,,,,1805,"Cocoa powder, not containing added sugar",8,Weight in kilograms,7846364,,,,7846364,,26649845,,,0
H2,2010,2010,2010,4,0,1,Import,364,Iran,IRN,0,World,WLD,,,,,,,,1806,Chocolate and other food preparations containing cocoa.,8,Weight in kilograms,3229642,,,,3229642,,9499938,,,0
H2,2010,2010,2010,4,0,1,Import,364,Iran,IRN,0,World,WLD,,,,,,,,1901,Malt extract; food preparations of flour,8,Weight in kilograms,1503986,,,,1503986,,6378425,,,0
H2,2010,2010,2010,4,0,1,Import,364,Iran,IRN,0,World,WLD,,,,,,,,1902,"Pasta, whether or not cooked or stuffed",8,Weight in kilograms,412285,,,,412285,,176538,,,0
H2,2010,2010,2010,4,0,1,Import,364,Iran,IRN,0,World,WLD,,,,,,,,1903,Tapioca and substitutes therefor prepared from starch,8,Weight in kilograms,133000,,,,133000,,31472,,,0
H2,2010,2010,2010,4,0,1,Import,364,Iran,IRN,0,World,WLD,,,,,,,,1904,Prepared foods,8,Weight in kilograms,1405317,,,,1405317,,4044487,,,0
H2,2010,2010,2010,4,0,1,Import,364,Iran,IRN,0,World,WLD,,,,,,,,1905,"Bread, pastry, cakes, biscuits and other bakers' wares",8,Weight in kilograms,823721,,,,823721,,1204191,,,0
H2,2010,2010,2010,4,0,1,Import,364,Iran,IRN,0,World,WLD,,,,,,,,2001,"Vegetables, fruit or nuts",8,Weight in kilograms,16207,,,,16207,,16216,,,0
H2,2010,2010,2010,4,0,1,Import,364,Iran,IRN,0,World,WLD,,,,,,,,2003,"Mushrooms and truffles, prepared or preserved",8,Weight in kilograms,23400,,,,23400,,21065,,,0
H2,2010,2010,2010,4,0,1,Import,364,Iran,IRN,0,World,WLD,,,,,,,,2004,Other vegetables prepared or preserved,8,Weight in kilograms,71300,,,,71300,,39003,,,0
H2,2010,2010,2010,4,0,1,Import,364,Iran,IRN,0,World,WLD,,,,,,,,2005,Other vegetables prepared or preserved,8,Weight in kilograms,11624131,,,,11624131,,8077944,,,0
H2,2010,2010,2010,4,0,1,Import,364,Iran,IRN,0,World,WLD,,,,,,,,2006,"Vegetables, fruit, nuts, fruit-peel",8,Weight in kilograms,6889156,,,,6889156,,3653470,,,0
H2,2010,2010,2010,4,0,1,Import,364,Iran,IRN,0,World,WLD,,,,,,,,2007,"Jams, fruit jellies, marmalades, fruit or nut pastes",8,Weight in kilograms,17930406,,,,17930406,,16485450,,,0
H2,2010,2010,2010,4,0,1,Import,364,Iran,IRN,0,World,WLD,,,,,,,,2008,"Fruit, nuts and other edible parts of plants",8,Weight in kilograms,33300646,,,,33300646,,21430970,,,0
H2,2010,2010,2010,4,0,1,Import,364,Iran,IRN,0,World,WLD,,,,,,,,2009,Fruit juices (including grape must) and vegetable juices,8,Weight in kilograms,11219937,,,,11219937,,12918116,,,0
H2,2010,2010,2010,4,0,1,Import,364,Iran,IRN,0,World,WLD,,,,,,,,2101,"Extracts, essences and concentrates, of coffee, tea or mat",8,Weight in kilograms,6748366,,,,6748366,,21815594,,,0
H2,2010,2010,2010,4,0,1,Import,364,Iran,IRN,0,World,WLD,,,,,,,,2102,Yeasts (active or inactive),8,Weight in kilograms,162948,,,,162948,,1948735,,,0
H2,2010,2010,2010,4,0,1,Import,364,Iran,IRN,0,World,WLD,,,,,,,,2103,Sauces and preparations therefor,8,Weight in kilograms,769842,,,,769842,,1382869,,,0
H2,2010,2010,2010,4,0,1,Import,364,Iran,IRN,0,World,WLD,,,,,,,,2104,Soups and broths and preparations therefor,8,Weight in kilograms,1001264,,,,1001264,,3037435,,,0
H2,2010,2010,2010,4,0,1,Import,364,Iran,IRN,0,World,WLD,,,,,,,,2106,Food preparations not elsewhere specified or included.,8,Weight in kilograms,31873433,,,,31873433,,176850780,,,0
H2,2010,2010,2010,4,0,1,Import,364,Iran,IRN,0,World,WLD,,,,,,,,2301,"Flours, meals and pellets, of meat or meat offal",8,Weight in kilograms,1279703,,,,1279703,,2801837,,,0
H2,2010,2010,2010,4,0,1,Import,364,Iran,IRN,0,World,WLD,,,,,,,,2302,"Bran, sharps and other residues",8,Weight in kilograms,107792549,,,,107792549,,16361933,,,0
H2,2010,2010,2010,4,0,1,Import,364,Iran,IRN,0,World,WLD,,,,,,,,2303,Residues of starch manufacture and similar residues,8,Weight in kilograms,8461634,,,,8461634,,1634260,,,0
H2,2010,2010,2010,4,0,1,Import,364,Iran,IRN,0,World,WLD,,,,,,,,2304,Oil-cake and other solid residues,8,Weight in kilograms,1690029153,,,,1690029153,,735541242,,,0
H2,2010,2010,2010,4,0,1,Import,364,Iran,IRN,0,World,WLD,,,,,,,,2306,Oil-cake and other solid residues,8,Weight in kilograms,251324160,,,,251324160,,45852421,,,0
H2,2010,2010,2010,4,0,1,Import,364,Iran,IRN,0,World,WLD,,,,,,,,2308,Vegetable materials and vegetable waste,8,Weight in kilograms,26000,,,,26000,,18286,,,0
H2,2010,2010,2010,4,0,1,Import,364,Iran,IRN,0,World,WLD,,,,,,,,2309,Preparations of a kind used in animal feeding.,8,Weight in kilograms,38884903,,,,38884903,,41281343,,,0
H2,2010,2010,2010,4,0,1,Import,364,Iran,IRN,0,World,WLD,,,,,,,,2401,Unmanufactured tobacco; tobacco refuse.,8,Weight in kilograms,12866272,,,,12866272,,73795776,,,0
H2,2010,2010,2010,4,0,1,Import,364,Iran,IRN,0,World,WLD,,,,,,,,2402,"Cigars, cheroots, cigarillos and cigarettes",8,Weight in kilograms,6150990,,,,6150990,,96831138,,,0
H2,2010,2010,2010,4,0,1,Import,364,Iran,IRN,0,World,WLD,,,,,,,,2403,Other manufactured tobacco and tobacco substitutes,8,Weight in kilograms,7872988,,,,7872988,,30164333,,,0
H2,2010,2010,2010,4,0,1,Import,364,Iran,IRN,0,World,WLD,,,,,,,,2501,Salt (including table salt),8,Weight in kilograms,364419,,,,364419,,708760,,,0
H2,2010,2010,2010,4,0,1,Import,364,Iran,IRN,0,World,WLD,,,,,,,,2502,Unroasted iron pyrites.,8,Weight in kilograms,1000,,,,1000,,743,,,0
H2,2010,2010,2010,4,0,1,Import,364,Iran,IRN,0,World,WLD,,,,,,,,2503,Sulphur of all kinds,8,Weight in kilograms,731711,,,,731711,,1494008,,,0
H2,2010,2010,2010,4,0,1,Import,364,Iran,IRN,0,World,WLD,,,,,,,,2504,Natural graphite.,8,Weight in kilograms,2501090,,,,2501090,,2072393,,,0
H2,2010,2010,2010,4,0,1,Import,364,Iran,IRN,0,World,WLD,,,,,,,,2505,Natural sands of all kinds,8,Weight in kilograms,4137315,,,,4137315,,1261422,,,0
H2,2010,2010,2010,4,0,1,Import,364,Iran,IRN,0,World,WLD,,,,,,,,2506,Quartz (other than natural sands); quartzite,8,Weight in kilograms,3554160,,,,3554160,,1473448,,,0
H2,2010,2010,2010,4,0,1,Import,364,Iran,IRN,0,World,WLD,,,,,,,,2507,"Kaolin and other kaolinic clays, whether or not calcined.",8,Weight in kilograms,57618880,,,,57618880,,12090181,,,0
H2,2010,2010,2010,4,0,1,Import,364,Iran,IRN,0,World,WLD,,,,,,,,2508,"Other clays (not including expanded clays of heading 68.06), andalusite, ky ...",8,Weight in kilograms,6045477,,,,6045477,,2601375,,,0
H2,2010,2010,2010,4,0,1,Import,364,Iran,IRN,0,World,WLD,,,,,,,,2509,Chalk.,8,Weight in kilograms,12000,,,,12000,,14409,,,0
H2,2010,2010,2010,4,0,1,Import,364,Iran,IRN,0,World,WLD,,,,,,,,2510,Natural calcium phosphates,8,Weight in kilograms,68574000,,,,68574000,,8549184,,,0
H2,2010,2010,2010,4,0,1,Import,364,Iran,IRN,0,World,WLD,,,,,,,,2511,Natural barium sulphate (barytes),8,Weight in kilograms,2286850,,,,2286850,,392970,,,0
H2,2010,2010,2010,4,0,1,Import,364,Iran,IRN,0,World,WLD,,,,,,,,2512,Siliceous fossil meals,8,Weight in kilograms,1228172,,,,1228172,,669220,,,0
H2,2010,2010,2010,4,0,1,Import,364,Iran,IRN,0,World,WLD,,,,,,,,2513,Pumice stone; emery; other natural abrasives,8,Weight in kilograms,1475612,,,,1475612,,419358,,,0
H2,2010,2010,2010,4,0,1,Import,364,Iran,IRN,0,World,WLD,,,,,,,,2515,"Marble, travertine, ecaussine and other stone",8,Weight in kilograms,2489348,,,,2489348,,363536,,,0
H2,2010,2010,2010,4,0,1,Import,364,Iran,IRN,0,World,WLD,,,,,,,,2516,"Granite, porphyry, basalt, sandstone and other stone",8,Weight in kilograms,2579472,,,,2579472,,640528,,,0
H2,2010,2010,2010,4,0,1,Import,364,Iran,IRN,0,World,WLD,,,,,,,,2517,"Pebbles, gravel, broken or crushed stone",8,Weight in kilograms,2047582,,,,2047582,,648742,,,0
H2,2010,2010,2010,4,0,1,Import,364,Iran,IRN,0,World,WLD,,,,,,,,2519,Natural magnesium carbonate (magnesite),8,Weight in kilograms,39358573,,,,39358573,,20914015,,,0
H2,2010,2010,2010,4,0,1,Import,364,Iran,IRN,0,World,WLD,,,,,,,,2520,Gypsum; anhydrite; plasters,8,Weight in kilograms,625821,,,,625821,,270799,,,0
H2,2010,2010,2010,4,0,1,Import,364,Iran,IRN,0,World,WLD,,,,,,,,2521,Limestone flux; limestone,8,Weight in kilograms,95969,,,,95969,,103853,,,0
H2,2010,2010,2010,4,0,1,Import,364,Iran,IRN,0,World,WLD,,,,,,,,2522,"Quicklime, slaked lime and hydraulic lime",8,Weight in kilograms,44650,,,,44650,,23428,,,0
H2,2010,2010,2010,4,0,1,Import,364,Iran,IRN,0,World,WLD,,,,,,,,2523,"Portland cement, aluminous cement, slag cement",8,Weight in kilograms,10478016,,,,10478016,,8817881,,,0
H2,2010,2010,2010,4,0,1,Import,364,Iran,IRN,0,World,WLD,,,,,,,,2524,Asbestos.,8,Weight in kilograms,32004350,,,,32004350,,19470720,,,0
H2,2010,2010,2010,4,0,1,Import,364,Iran,IRN,0,World,WLD,,,,,,,,2525,"Mica, including splitings; mica waste.",8,Weight in kilograms,6548997,,,,6548997,,2647233,,,0
H2,2010,2010,2010,4,0,1,Import,364,Iran,IRN,0,World,WLD,,,,,,,,2526,"Natural steatite, whether or not roughly trimmed",8,Weight in kilograms,1634216,,,,1634216,,657344,,,0
H2,2010,2010,2010,4,0,1,Import,364,Iran,IRN,0,World,WLD,,,,,,,,2528,Natural borates and concentrates thereof,8,Weight in kilograms,818000,,,,818000,,422908,,,0
H2,2010,2010,2010,4,0,1,Import,364,Iran,IRN,0,World,WLD,,,,,,,,2529,Felspar; leucite and nepheline syenite,8,Weight in kilograms,25284736,,,,25284736,,3724852,,,0
H2,2010,2010,2010,4,0,1,Import,364,Iran,IRN,0,World,WLD,,,,,,,,2530,Mineral substances,8,Weight in kilograms,22797955,,,,22797955,,24758997,,,0
H2,2010,2010,2010,4,0,1,Import,364,Iran,IRN,0,World,WLD,,,,,,,,2601,Iron ores and concentrates,8,Weight in kilograms,370461754,,,,370461754,,44253067,,,0
H2,2010,2010,2010,4,0,1,Import,364,Iran,IRN,0,World,WLD,,,,,,,,2602,Manganese ores and concentrates,8,Weight in kilograms,47733495,,,,47733495,,10852892,,,0
H2,2010,2010,2010,4,0,1,Import,364,Iran,IRN,0,World,WLD,,,,,,,,2603,Copper ores and concentrates.,8,Weight in kilograms,20000,,,,20000,,79311,,,0
H2,2010,2010,2010,4,0,1,Import,364,Iran,IRN,0,World,WLD,,,,,,,,2606,Aluminium ores and concentrates.,8,Weight in kilograms,23037300,,,,23037300,,11177412,,,0
H2,2010,2010,2010,4,0,1,Import,364,Iran,IRN,0,World,WLD,,,,,,,,2608,Zinc ores and concentrates.,8,Weight in kilograms,16746810,,,,16746810,,1077823,,,0
H2,2010,2010,2010,4,0,1,Import,364,Iran,IRN,0,World,WLD,,,,,,,,2610,Chromium ores and concentrates.,8,Weight in kilograms,1088048,,,,1088048,,530021,,,0
H2,2010,2010,2010,4,0,1,Import,364,Iran,IRN,0,World,WLD,,,,,,,,2614,Titanium ores and concentrates.,8,Weight in kilograms,14271365,,,,14271365,,10511623,,,0
H2,2010,2010,2010,4,0,1,Import,364,Iran,IRN,0,World,WLD,,,,,,,,2615,"Niobium, tantalum, vanadium and concentrates.",8,Weight in kilograms,11576519,,,,11576519,,14476024,,,0
H2,2010,2010,2010,4,0,1,Import,364,Iran,IRN,0,World,WLD,,,,,,,,2620,Ash and residues,8,Weight in kilograms,217517,,,,217517,,60518,,,0
H2,2010,2010,2010,4,0,1,Import,364,Iran,IRN,0,World,WLD,,,,,,,,2621,"Other slag and ash, including seaweed ash",8,Weight in kilograms,1189030,,,,1189030,,412395,,,0
H2,2010,2010,2010,4,0,1,Import,364,Iran,IRN,0,World,WLD,,,,,,,,2701,"Coal; briquettes, ovoids and similar solid fuels manufactured from coal.",8,Weight in kilograms,1061380,,,,1061380,,454549,,,0
H2,2010,2010,2010,4,0,1,Import,364,Iran,IRN,0,World,WLD,,,,,,,,2703,Peat (including peat litter),8,Weight in kilograms,7017665,,,,7017665,,1048336,,,0
H2,2010,2010,2010,4,0,1,Import,364,Iran,IRN,0,World,WLD,,,,,,,,2704,"Coke and semi-coke of coal, of lignite or of peat",8,Weight in kilograms,912060406,,,,912060406,,407213407,,,0
H2,2010,2010,2010,4,0,1,Import,364,Iran,IRN,0,World,WLD,,,,,,,,2706,"Tar distilled from coal, from lignite or from peat",8,Weight in kilograms,1721650,,,,1721650,,553821,,,0
H2,2010,2010,2010,4,0,1,Import,364,Iran,IRN,0,World,WLD,,,,,,,,2707,Oils and other products of high temperature coal tar,8,Weight in kilograms,1310808,,,,1310808,,1646566,,,0
H2,2010,2010,2010,4,0,1,Import,364,Iran,IRN,0,World,WLD,,,,,,,,2708,"Pitch and pitch coke, obtained from coal tar",8,Weight in kilograms,1879727,,,,1879727,,722449,,,0
H2,2010,2010,2010,4,0,1,Import,364,Iran,IRN,0,World,WLD,,,,,,,,2710,"Petroleum oils, other than crude",8,Weight in kilograms,1677016880,,,,1677016880,,1019204761,,,0
H2,2010,2010,2010,4,0,1,Import,364,Iran,IRN,0,World,WLD,,,,,,,,2711,Petroleum gases and other gaseous hydrocarbons.,8,Weight in kilograms,32339511,,,,32339511,,17318233,,,0
H2,2010,2010,2010,4,0,1,Import,364,Iran,IRN,0,World,WLD,,,,,,,,2712,Petroleum jelly and wax,8,Weight in kilograms,3486540,,,,3486540,,5553794,,,0
H2,2010,2010,2010,4,0,1,Import,364,Iran,IRN,0,World,WLD,,,,,,,,2713,Petroleum coke and other residues,8,Weight in kilograms,64130265,,,,64130265,,18700917,,,0
H2,2010,2010,2010,4,0,1,Import,364,Iran,IRN,0,World,WLD,,,,,,,,2714,"Bitumen and asphalt, natural",8,Weight in kilograms,57678,,,,57678,,40557,,,0
H2,2010,2010,2010,4,0,1,Import,364,Iran,IRN,0,World,WLD,,,,,,,,2715,Bituminous mixtures based on natural asphalt,8,Weight in kilograms,73713,,,,73713,,76579,,,0
H2,2010,2010,2010,4,0,1,Import,364,Iran,IRN,0,World,WLD,,,,,,,,2801,"Fluorine, chlorine, bromine and iodine.",8,Weight in kilograms,196025,,,,196025,,5255047,,,0
H2,2010,2010,2010,4,0,1,Import,364,Iran,IRN,0,World,WLD,,,,,,,,2802,"Sulphur, sublimed or precipitated",8,Weight in kilograms,263345,,,,263345,,836860,,,0
H2,2010,2010,2010,4,0,1,Import,364,Iran,IRN,0,World,WLD,,,,,,,,2803,Carbon,8,Weight in kilograms,14854213,,,,14854213,,17760480,,,0
H2,2010,2010,2010,4,0,1,Import,364,Iran,IRN,0,World,WLD,,,,,,,,2805,Alkali or alkaline-earth metals;,8,Weight in kilograms,246390,,,,246390,,1002436,,,0
H2,2010,2010,2010,4,0,1,Import,364,Iran,IRN,0,World,WLD,,,,,,,,2806,Hydrogen chloride (hydrochloric acid);,8,Weight in kilograms,8636,,,,8636,,65066,,,0
H2,2010,2010,2010,4,0,1,Import,364,Iran,IRN,0,World,WLD,,,,,,,,2807,Sulphuric acid; oleum.,8,Weight in kilograms,64546,,,,64546,,352973,,,0
H2,2010,2010,2010,4,0,1,Import,364,Iran,IRN,0,World,WLD,,,,,,,,2808,Nitric acid; sulphonitric acids.,8,Weight in kilograms,42406,,,,42406,,562884,,,0
H2,2010,2010,2010,4,0,1,Import,364,Iran,IRN,0,World,WLD,,,,,,,,2809,Diphosphorus pentaoxide; phosphoric acid;,8,Weight in kilograms,33248292,,,,33248292,,25088674,,,0
H2,2010,2010,2010,4,0,1,Import,364,Iran,IRN,0,World,WLD,,,,,,,,2810,Oxides of boron; boric acids.,8,Weight in kilograms,10279202,,,,10279202,,7676714,,,0
H2,2010,2010,2010,4,0,1,Import,364,Iran,IRN,0,World,WLD,,,,,,,,2811,Other inorganic acids and oxygen compounds,8,Weight in kilograms,4231369,,,,4231369,,11024190,,,0
H2,2010,2010,2010,4,0,1,Import,364,Iran,IRN,0,World,WLD,,,,,,,,2812,Halides and halide oxides of non-metals.,8,Weight in kilograms,82280,,,,82280,,343941,,,0
H2,2010,2010,2010,4,0,1,Import,364,Iran,IRN,0,World,WLD,,,,,,,,2813,Sulphides of non-metals; commercial phosphorus trisulphide.,8,Weight in kilograms,8346,,,,8346,,957670,,,0
H2,2010,2010,2010,4,0,1,Import,364,Iran,IRN,0,World,WLD,,,,,,,,2814,"Ammonia, anhydrous or in aqueous solution.",8,Weight in kilograms,34396,,,,34396,,112192,,,0
H2,2010,2010,2010,4,0,1,Import,364,Iran,IRN,0,World,WLD,,,,,,,,2815,Sodium hydroxide (caustic soda);,8,Weight in kilograms,65158936,,,,65158936,,18729593,,,0
H2,2010,2010,2010,4,0,1,Import,364,Iran,IRN,0,World,WLD,,,,,,,,2816,Hydroxide and peroxide of magnesium;,8,Weight in kilograms,197600,,,,197600,,225872,,,0
H2,2010,2010,2010,4,0,1,Import,364,Iran,IRN,0,World,WLD,,,,,,,,2817,Zinc oxide; zinc peroxide.,8,Weight in kilograms,208731,,,,208731,,546387,,,0
H2,2010,2010,2010,4,0,1,Import,364,Iran,IRN,0,World,WLD,,,,,,,,2818,"Artificial corundum, whether or not chemically defined;",8,Weight in kilograms,60383468,,,,60383468,,36752059,,,0
H2,2010,2010,2010,4,0,1,Import,364,Iran,IRN,0,World,WLD,,,,,,,,2819,Chromium oxides and hydroxides.,8,Weight in kilograms,732200,,,,732200,,2468761,,,0
H2,2010,2010,2010,4,0,1,Import,364,Iran,IRN,0,World,WLD,,,,,,,,2820,Manganese oxides.,8,Weight in kilograms,335100,,,,335100,,256874,,,0
H2,2010,2010,2010,4,0,1,Import,364,Iran,IRN,0,World,WLD,,,,,,,,2821,Iron oxides and hydroxides,8,Weight in kilograms,4657752,,,,4657752,,4012136,,,0
H2,2010,2010,2010,4,0,1,Import,364,Iran,IRN,0,World,WLD,,,,,,,,2822,Cobalt oxides and hydroxides,8,Weight in kilograms,159760,,,,159760,,2916952,,,0
H2,2010,2010,2010,4,0,1,Import,364,Iran,IRN,0,World,WLD,,,,,,,,2823,Titanium oxides.,8,Weight in kilograms,19260423,,,,19260423,,39517185,,,0
H2,2010,2010,2010,4,0,1,Import,364,Iran,IRN,0,World,WLD,,,,,,,,2824,Lead oxides; red lead and orange lead.,8,Weight in kilograms,1176598,,,,1176598,,2909471,,,0
